{
  "schema_version": "0.2",
  "authority_id": "11111111-1111-4111-8111-111111111111",
  "requester_id": "agent-writer-001",
  "issuer_id": "human-admin-001",
  "subject_id": "agent-writer-001",
  "scope": [
    "write:document"
  ],
  "decision": "allow",
  "source_type": "human",
  "issued_at": "2026-10-03T04:30:00+09:00",
  "expires_at": "2026-10-03T05:30:00+09:00",
  "revoked_at": null,
  "delegation_parent": null
}
